{
  "proposal_id": "proposal.supply-ops.0001",
  "proposal_type": "commitment_recovery",
  "status": "submitted",
  "proposer": {
    "actor_id": "agent.supply-ops-planner-01",
    "actor_type": "agent"
  },
  "target_entities": [
    {
      "entity_id": "commitment.retailer-4821",
      "entity_type": "order_commitment"
    },
    {
      "entity_id": "inventory.dallas.dc.widget-alpha",
      "entity_type": "inventory_position"
    },
    {
      "entity_id": "capacity.dallas.packout.2026-03-23",
      "entity_type": "capacity_bucket"
    },
    {
      "entity_id": "lane.dallas-atl.expedited",
      "entity_type": "fulfillment_lane"
    }
  ],
  "proposed_action": {
    "action_type": "rebalance_inventory_and_expedite_commitment",
    "parameters": {
      "commitment_id": "commitment.retailer-4821",
      "source_inventory_id": "inventory.dallas.dc.widget-alpha",
      "reserve_capacity_id": "capacity.dallas.packout.2026-03-23",
      "lane_id": "lane.dallas-atl.expedited",
      "reallocation_units": 180,
      "projected_fill_rate_percent": 98,
      "projected_post_action_inventory_days": 2,
      "expedite_cost_delta_percent": 14,
      "simulation_completed": true,
      "simulation_id": "sim.supply-ops.0001"
    }
  },
  "justification": "Rebalance available inventory and reserve packout capacity to recover the at-risk commitment before the promised date.",
  "created_at": "2026-03-22T09:09:00Z"
}
