[
  {
    "proposal_id": "proposal.reroute.expedite.0002",
    "proposal_type": "operational_response",
    "status": "submitted",
    "proposer": {
      "actor_id": "agent.ops-planner-01",
      "actor_type": "agent"
    },
    "target_entities": [
      {
        "entity_id": "shipment.88421",
        "entity_type": "shipment"
      }
    ],
    "proposed_action": {
      "action_type": "reroute_shipment",
      "parameters": {
        "shipment_id": "shipment.88421",
        "new_route": "route.expedite-texas-09",
        "cost_delta_percent": 11
      }
    },
    "justification": "Expedite the shipment to minimize downstream delay.",
    "created_at": "2026-03-08T11:20:30Z"
  },
  {
    "proposal_id": "proposal.reroute.defer.0003",
    "proposal_type": "operational_response",
    "status": "submitted",
    "proposer": {
      "actor_id": "agent.ops-planner-01",
      "actor_type": "agent"
    },
    "target_entities": [
      {
        "entity_id": "shipment.88421",
        "entity_type": "shipment"
      }
    ],
    "proposed_action": {
      "action_type": "hold_current_route",
      "parameters": {
        "shipment_id": "shipment.88421",
        "cost_delta_percent": 0
      }
    },
    "justification": "Avoid extra spend and absorb the baseline delay instead.",
    "created_at": "2026-03-08T11:20:45Z"
  }
]
