[
  {
    "proposal_id": "proposal.semantic-system.unsafe.0001",
    "proposal_type": "semantic_change",
    "status": "submitted",
    "proposer": {
      "actor_id": "agent.semantic-steward-01",
      "actor_type": "agent"
    },
    "target_entities": [
      {
        "entity_id": "term.customer_status",
        "entity_type": "semantic_term"
      },
      {
        "entity_id": "mapping.crm.customer_status",
        "entity_type": "semantic_mapping"
      },
      {
        "entity_id": "definition.customer_status.v2",
        "entity_type": "semantic_definition"
      }
    ],
    "proposed_action": {
      "action_type": "promote_semantic_definition_change",
      "parameters": {
        "term_id": "term.customer_status",
        "current_definition_id": "definition.customer_status.v1",
        "candidate_definition_id": "definition.customer_status.v2",
        "conflict_score": 94,
        "breaking_change": true,
        "provenance_complete": false,
        "review_window_simulated": false
      }
    },
    "justification": "Ship the new meaning immediately to reduce duplicate review cycles.",
    "created_at": "2026-03-23T10:06:15Z"
  },
  {
    "proposal_id": "proposal.semantic-system.alias.0002",
    "proposal_type": "semantic_change",
    "status": "submitted",
    "proposer": {
      "actor_id": "agent.semantic-steward-01",
      "actor_type": "agent"
    },
    "target_entities": [
      {
        "entity_id": "term.customer_status",
        "entity_type": "semantic_term"
      },
      {
        "entity_id": "mapping.crm.customer_status",
        "entity_type": "semantic_mapping"
      },
      {
        "entity_id": "definition.customer_status.v2",
        "entity_type": "semantic_definition"
      }
    ],
    "proposed_action": {
      "action_type": "add_semantic_alias",
      "parameters": {
        "term_id": "term.customer_status",
        "current_definition_id": "definition.customer_status.v1",
        "candidate_definition_id": "definition.customer_status.v2",
        "conflict_score": 28,
        "breaking_change": false,
        "provenance_complete": true,
        "review_window_simulated": true
      }
    },
    "justification": "Introduce the new meaning as a governed alias before a later breaking cutover.",
    "created_at": "2026-03-23T10:06:30Z"
  }
]
