[
  {
    "proposal_id": "proposal.digital-twin.unsafe.0002",
    "proposal_type": "overlay_guidance",
    "status": "submitted",
    "proposer": {
      "actor_id": "agent.digital-twin-orchestrator-01",
      "actor_type": "agent"
    },
    "target_entities": [
      {
        "entity_id": "feed.digital-twin.metro-mesh",
        "entity_type": "dt_signal_feed"
      },
      {
        "entity_id": "control.digital-twin.metro-watchfloor",
        "entity_type": "dt_control_center"
      }
    ],
    "proposed_action": {
      "action_type": "write_overlay_decisions_directly_to_hosts",
      "parameters": {
        "host_bindings_verified": false,
        "writeback_to_host": true,
        "freshness_lag_minutes": 2,
        "cross_host_binding_count": 0,
        "projected_customer_interruptions_avoided": 0,
        "projected_residents_spared_from_extended_detours": 0,
        "overlay_scope": "hostless_writeback"
      }
    },
    "justification": "Bypass host review and push a direct overlay command into whatever runtime is available first.",
    "created_at": "2026-03-23T12:09:10Z"
  },
  {
    "proposal_id": "proposal.digital-twin.power-grid-first.0003",
    "proposal_type": "overlay_guidance",
    "status": "submitted",
    "proposer": {
      "actor_id": "agent.digital-twin-orchestrator-01",
      "actor_type": "agent"
    },
    "target_entities": [
      {
        "entity_id": "binding.digital-twin.power-grid.0001",
        "entity_type": "dt_host_binding"
      },
      {
        "entity_id": "overlay.digital-twin.power-grid",
        "entity_type": "dt_overlay_model"
      }
    ],
    "proposed_action": {
      "action_type": "publish_power_grid_overlay_guidance",
      "parameters": {
        "host_bindings_verified": true,
        "writeback_to_host": false,
        "freshness_lag_minutes": 4,
        "cross_host_binding_count": 1,
        "projected_customer_interruptions_avoided": 9100,
        "projected_residents_spared_from_extended_detours": 0,
        "overlay_scope": "power_grid_only"
      }
    },
    "justification": "Start with the power-grid host only while the civic telemetry settles into a stable overlay window.",
    "created_at": "2026-03-23T12:09:20Z"
  }
]
