{
  "proposal_id": "proposal.autonomous-vehicle.0001",
  "proposal_type": "motion_intervention_plan",
  "status": "submitted",
  "proposer": {
    "actor_id": "agent.motion-supervisor-01",
    "actor_type": "agent"
  },
  "target_entities": [
    {
      "entity_id": "vehicle.av.17",
      "entity_type": "autonomous_vehicle"
    },
    {
      "entity_id": "road.segment.river.12",
      "entity_type": "road_segment"
    },
    {
      "entity_id": "supervisor.remote.02",
      "entity_type": "remote_supervisor"
    }
  ],
  "proposed_action": {
    "action_type": "supervised_creep_through_occlusion",
    "parameters": {
      "vehicle_id": "vehicle.av.17",
      "road_segment_id": "road.segment.river.12",
      "remote_supervisor_id": "supervisor.remote.02",
      "planned_speed_kph": 18,
      "minimum_clearance_meters": 1.8,
      "occluded_crosswalk_probability_percent": 52,
      "remote_supervisor_connected": true,
      "fallback_stop_distance_meters": 12
    }
  },
  "justification": "A supervised low-speed creep keeps the delivery corridor moving while maintaining a viable stop distance through the occlusion.",
  "created_at": "2026-03-23T13:19:20Z"
}
