{
  "proposal_id": "proposal.air-traffic.0001",
  "proposal_type": "operational_response",
  "status": "submitted",
  "proposer": {
    "actor_id": "agent.atc-assistant-01",
    "actor_type": "agent"
  },
  "target_entities": [
    {
      "entity_id": "flight.ual2187",
      "entity_type": "flight"
    },
    {
      "entity_id": "runway.kord.10c-28c",
      "entity_type": "runway"
    }
  ],
  "proposed_action": {
    "action_type": "reroute_arrival_to_closed_runway",
    "parameters": {
      "flight_id": "flight.ual2187",
      "runway_id": "runway.kord.10c-28c",
      "minimum_separation_nm": 5,
      "fuel_buffer_minutes": 24,
      "simulation_completed": false
    }
  },
  "justification": "Preserve arrival throughput during weather disruptions.",
  "created_at": "2026-03-09T08:12:00Z"
}
