{
  "proposal_id": "proposal.semantic-system.0001",
  "proposal_type": "semantic_change",
  "status": "submitted",
  "proposer": {
    "actor_id": "agent.semantic-steward-01",
    "actor_type": "agent"
  },
  "target_entities": [
    {
      "entity_id": "term.customer_status",
      "entity_type": "semantic_term"
    },
    {
      "entity_id": "mapping.crm.customer_status",
      "entity_type": "semantic_mapping"
    },
    {
      "entity_id": "definition.customer_status.v2",
      "entity_type": "semantic_definition"
    }
  ],
  "proposed_action": {
    "action_type": "promote_semantic_definition_change",
    "parameters": {
      "term_id": "term.customer_status",
      "current_definition_id": "definition.customer_status.v1",
      "candidate_definition_id": "definition.customer_status.v2",
      "conflict_score": 82,
      "breaking_change": true,
      "provenance_complete": true,
      "review_window_simulated": true
    }
  },
  "justification": "Align CRM semantics with service-entitlement workflows without orphaning downstream mappings.",
  "created_at": "2026-03-23T10:06:00Z"
}
