{
  "proposal_id": "proposal.reroute.0001",
  "proposal_type": "operational_response",
  "status": "submitted",
  "proposer": {
    "actor_id": "agent.ops-planner-01",
    "actor_type": "agent",
    "display_name": "Ops Planner Agent"
  },
  "target_entities": [
    {
      "entity_id": "shipment.88421",
      "entity_type": "shipment"
    },
    {
      "entity_id": "factory.acme.dallas",
      "entity_type": "factory"
    }
  ],
  "proposed_action": {
    "action_type": "reroute_shipment",
    "parameters": {
      "shipment_id": "shipment.88421",
      "new_route": "route.alt-texas-02",
      "cost_delta_percent": 6
    },
    "expected_effects": [
      "reduce delay impact on factory output",
      "increase transport cost by 6 percent"
    ]
  },
  "justification": "Factory output is at risk due to the current shipment delay.",
  "required_capabilities": [
    "route_planning",
    "transport_rebooking"
  ],
  "supporting_evidence": [
    {
      "evidence_type": "event",
      "ref_id": "evt.shipment-delay.0001",
      "summary": "Shipment delay detected at 18 hours."
    }
  ],
  "policy_preview": [
    {
      "policy_name": "reroute_requires_cost_check",
      "outcome": "warn",
      "message": "Cost variance exceeds soft threshold."
    }
  ],
  "simulation_refs": [
    "sim.delay-response.0001"
  ],
  "created_at": "2026-03-08T11:20:00Z",
  "updated_at": "2026-03-08T11:20:00Z",
  "submitted_at": "2026-03-08T11:20:05Z",
  "metadata": {
    "adapter": "supply-network"
  },
  "correlation_id": "corr.supply-event.20260308.01"
}
