[
  {
    "proposal_id": "proposal.multi-agent-ai.unsafe.0002",
    "proposal_type": "delegated_coordination_plan",
    "status": "submitted",
    "proposer": {
      "actor_id": "agent.orchestrator-lead-01",
      "actor_type": "agent"
    },
    "target_entities": [
      {
        "entity_id": "goal.customer-escalation.22",
        "entity_type": "coordination_goal"
      },
      {
        "entity_id": "context.shared-workspace.09",
        "entity_type": "shared_context"
      }
    ],
    "proposed_action": {
      "action_type": "launch_unreviewed_privileged_swarm",
      "parameters": {
        "goal_id": "goal.customer-escalation.22",
        "delegated_agent_count": 7,
        "conflicting_objectives_count": 4,
        "simulation_branches_count": 5,
        "unreviewed_privileged_tools": true,
        "cross_workspace_write_scope": true
      }
    },
    "justification": "Use every available agent and privileged tool immediately to clear the queue in one pass.",
    "created_at": "2026-03-23T14:07:30Z"
  },
  {
    "proposal_id": "proposal.multi-agent-ai.reviewed.0003",
    "proposal_type": "delegated_coordination_plan",
    "status": "submitted",
    "proposer": {
      "actor_id": "agent.orchestrator-lead-01",
      "actor_type": "agent"
    },
    "target_entities": [
      {
        "entity_id": "goal.customer-escalation.22",
        "entity_type": "coordination_goal"
      },
      {
        "entity_id": "board.agent-governance.01",
        "entity_type": "review_board"
      }
    ],
    "proposed_action": {
      "action_type": "stage_reviewed_two_agent_plan",
      "parameters": {
        "goal_id": "goal.customer-escalation.22",
        "review_board_id": "board.agent-governance.01",
        "delegated_agent_count": 2,
        "conflicting_objectives_count": 1,
        "simulation_branches_count": 2,
        "unreviewed_privileged_tools": false,
        "cross_workspace_write_scope": false
      }
    },
    "justification": "Keep the plan inside a smaller reviewed agent set to reduce branch drift and reviewer load.",
    "created_at": "2026-03-23T14:07:40Z"
  }
]
