[
  {
    "proposal_id": "proposal.open-agent-world.unsafe.0002",
    "proposal_type": "shared_world_intervention_plan",
    "status": "submitted",
    "proposer": {
      "actor_id": "agent.world-steward-01",
      "actor_type": "agent"
    },
    "target_entities": [
      {
        "entity_id": "zone.commons.delta",
        "entity_type": "world_zone"
      },
      {
        "entity_id": "pool.energy.delta",
        "entity_type": "resource_pool"
      }
    ],
    "proposed_action": {
      "action_type": "trigger_unbounded_replication_push",
      "parameters": {
        "zone_id": "zone.commons.delta",
        "cross_cohort_conflicts_count": 8,
        "replication_budget_percent": 88,
        "regions_under_intervention": 4,
        "governance_beacon_online": false
      }
    },
    "justification": "Expand every cohort immediately and let the commons self-correct through emergent abundance.",
    "created_at": "2026-03-23T14:13:30Z"
  },
  {
    "proposal_id": "proposal.open-agent-world.bounded.0003",
    "proposal_type": "shared_world_intervention_plan",
    "status": "submitted",
    "proposer": {
      "actor_id": "agent.world-steward-01",
      "actor_type": "agent"
    },
    "target_entities": [
      {
        "entity_id": "zone.commons.delta",
        "entity_type": "world_zone"
      },
      {
        "entity_id": "beacon.governance.delta",
        "entity_type": "governance_beacon"
      }
    ],
    "proposed_action": {
      "action_type": "stage_bounded_quota_shift",
      "parameters": {
        "zone_id": "zone.commons.delta",
        "governance_beacon_id": "beacon.governance.delta",
        "cross_cohort_conflicts_count": 2,
        "replication_budget_percent": 24,
        "regions_under_intervention": 1,
        "governance_beacon_online": true
      }
    },
    "justification": "Rebalance one region at a time while preserving beacon visibility and a lower replication budget.",
    "created_at": "2026-03-23T14:13:40Z"
  }
]
